include/rpl_init.inc [topology=1->2]
Warnings:
Note	####	Sending passwords in plain text without SSL/TLS is extremely insecure.
Note	####	Storing MySQL user name or password information in the master info repository is not secure and is therefore not recommended. Please consider using the USER and PASSWORD connection options for START SLAVE; see the 'START SLAVE Syntax' in the MySQL Manual for more information.
include/rpl_sync.inc
[connection server_1]
include/install_semisync_master.inc
####################################################################
# Test Case: check the thread_pool_size of threadpool mode
####################################################################
include/assert.inc [ should be 4]
SET GLOBAL rpl_semi_sync_master_enabled = 0;
set global rpl_semi_sync_master_timeout = 1000;
###################################################################
# Test Case: add slave 2
###################################################################
[connection server_2]
include/install_semisync_slave.inc
[connection server_1]
###################################################################
# the base config and status for quick sync
###################################################################
set global rpl_semi_sync_master_wait_cond_hwm = '2:0';
set global rpl_semi_sync_master_wait_cond_lwm = '2:0';
set global rpl_semi_sync_master_group1 = '2,3:1';
set global rpl_semi_sync_master_group2 = '1,4:1';
set global rpl_semi_sync_master_wait_no_slave = OFF;
set global rpl_semi_sync_master_enabled = ON;
include/assert.inc [Rpl_semi_sync_master_active_groups should be 1]
include/assert.inc [Rpl_semi_sync_master_current_stat_master_flag should be 0]
include/assert.inc [Rpl_semi_sync_master_current_wait_groups should be 2]
include/assert.inc [Rpl_semi_sync_master_err_flag should be 1]
include/assert.inc [Rpl_semi_sync_master_group1_status should be 1:GROUP_ACTIVE]
include/assert.inc [Rpl_semi_sync_master_group2_status should be 0:GROUP_UNACTIVE]
###################################################################
# test master_case_no_root.sql
###################################################################
[connection server_1]
drop user if exists repl_test;
Warnings:
Note	3162	Authorization ID 'repl_test'@'%' does not exist.
create user repl_test@'localhost' identified by 'repl_test';
create user repl_test@'%' identified by 'repl_test';
GRANT SELECT, INSERT, UPDATE, DELETE, CREATE, DROP, RELOAD, LOCK TABLES, REPLICATION SLAVE, REPLICATION CLIENT, 
CREATE ROUTINE, ALTER ROUTINE, CREATE TABLESPACE,ALTER,create temporary tables on *.* TO 'repl_test'@'localhost' ;
GRANT Process on *.* TO 'repl_test'@'localhost' ;
GRANT File on *.* TO 'repl_test'@'localhost' ;
GRANT Show view on *.* TO 'repl_test'@'localhost' ;
GRANT Trigger  on *.* TO 'repl_test'@'localhost' ;
GRANT event  on *.* TO 'repl_test'@'localhost' ;
GRANT grant option  on *.* TO 'repl_test'@'localhost' ;
GRANT SELECT, INSERT, UPDATE, DELETE, CREATE, DROP, RELOAD, LOCK TABLES, REPLICATION SLAVE, REPLICATION CLIENT, 
CREATE ROUTINE, ALTER ROUTINE, CREATE TABLESPACE,ALTER,create temporary tables on *.* TO 'repl_test'@'%' ;
drop database if exists it_quick_sync_read_only;
Warnings:
Note	1008	Can't drop database 'it_quick_sync_read_only'; database doesn't exist
create database it_quick_sync_read_only;
create database `#mysql50#a-b-c`;
use it_quick_sync_read_only;
drop table if exists t1;
Warnings:
Note	1051	Unknown table 'it_quick_sync_read_only.t1'
drop table if exists t2;
Warnings:
Note	1051	Unknown table 'it_quick_sync_read_only.t2'
drop table if exists t3;
Warnings:
Note	1051	Unknown table 'it_quick_sync_read_only.t3'
drop table if exists t4;
Warnings:
Note	1051	Unknown table 'it_quick_sync_read_only.t4'
create table t1(id int);
create index t1_index1 on t1(id);
create table t2(id int primary key, name varchar(10));
create table t3(id int);
create table t4(id int);
create table tb_test1(id int) engine = myisam;
create table tb_test2(id int) engine = myisam;
create view view1 as select t2.name from t1 join t2 where t1.id = t2.id;
create temporary table tmp1(id int, name varchar(20));
insert into t1 values(1),(2),(3);
insert into t2 values(1,'1'),(2,'2'),(3,'3');
insert into t3 values(4),(5),(6);
insert into t4 values(7),(8),(9);
insert into tmp1 values(10,'x'),(11,'y'),(12,'z');
create procedure sp_test1(p_id int)
begin
insert into t1 values(p_id);
end
//
call sp_test1(222);
create function sf_test1(p_id int) returns int
DETERMINISTIC
begin
return p_id * p_id;
end
//
select sf_test1(222);
sf_test1(222)
49284
set @sum = 0;
create trigger trig_test1 before insert on t1 for each row 
set @sum = @sum + new.id;
insert into t1 values(333);
select @sum;
@sum
333
create event event_test1
on schedule at CURRENT_TIMESTAMP  +  interval 1  minute 
do
update t3 set id = id + 20;
set global log_bin_trust_function_creators = true;
select 1;
1
1
select * from t1;
id
1
2
3
222
333
show databases;
show create database it_quick_sync_read_only;
show tables;
show tables from mysql;
show create table t1;
show table status;
show fields from t1;
show keys from t2;
show variables like '%thread%';
show status like '%thread%';
show engines;
show engine innodb logs;
show engine innodb status;
show engine innodb mutex;
show privileges;
show processlist;
show master status;
show slave status;
show slave hosts;
show grants;
show grants for repl_test;
show create user repl_test;
show create database it_quick_sync_read_only;
show create table t1;
show create view view1;
show create procedure sp_test1;
show create function sf_test1;
show create trigger trig_test1;
show create event event_test1;
show procedure status like 'sp_test2';
show function status like 'sf_test1';
show charset;
show character set;
show collation;
show binary logs;
show binlog events in 'master-bin.000001';
show open tables from  it_quick_sync_read_only;
show warnings;
show errors;
show engines;
show privileges;
show plugins;
show events;
set profiling = 1;
show profile all;
show profiles;
help 'select';
help 'str_to_date';
set @test_var = 0;
set global table_open_cache = 1024;
ERROR 42000: Access denied; you need (at least one of) the SUPER or SYSTEM_VARIABLES_ADMIN privilege(s) for this operation
use it_quick_sync_read_only;
ALTER DATABASE `#mysql50#a-b-c` UPGRADE DATA DIRECTORY NAME;
ERROR 42000: You have an error in your SQL syntax; check the manual that corresponds to your MySQL server version for the right syntax to use near 'UPGRADE DATA DIRECTORY NAME' at line 1
SET GLOBAL kc_fast.key_buffer_size = 128 * 1024;
ERROR 42000: Access denied; you need (at least one of) the SUPER or SYSTEM_VARIABLES_ADMIN privilege(s) for this operation
cache index tb_test1 ,tb_test2 in kc_fast;
ERROR 42000: INDEX command denied to user 'repl_test'@'localhost' for table 'tb_test1'
load index into cache t1,t2 IGNORE LEAVES;
ERROR 42000: INDEX command denied to user 'repl_test'@'localhost' for table 't1'
load index into cache tb_test1,tb_test2 IGNORE LEAVES;
ERROR 42000: INDEX command denied to user 'repl_test'@'localhost' for table 'tb_test1'
check table t1;
Table	Op	Msg_type	Msg_text
it_quick_sync_read_only.t1	check	status	OK
check table tb_test1;
Table	Op	Msg_type	Msg_text
it_quick_sync_read_only.tb_test1	check	status	OK
lock tables t1 read;
select * from t1;
id
1
2
3
222
333
unlock  tables;
flush tables;
flush table t1;
flush no_write_to_binlog table t1;
start transaction;
commit;
rollback;
commit;
start transaction;
select * from t1;
id
1
2
3
222
333
rollback;
start transaction;
select * from t1;
id
1
2
3
222
333
commit;
start transaction;
set global rpl_semi_sync_master_wait_cond_lwm = '1:0';
insert into t1 values(555);
set global rpl_semi_sync_master_wait_cond_lwm = '2:0';
rollback;
start transaction;
set global rpl_semi_sync_master_wait_cond_lwm = '1:0';
insert into t1 values(555);
set global rpl_semi_sync_master_wait_cond_lwm = '2:0';
commit;
ERROR HY000: Active groups is less than the lwm cond, only support read.
start transaction;
set global rpl_semi_sync_master_wait_cond_lwm = '1:0';
insert into t1 values(666);
set global rpl_semi_sync_master_wait_cond_lwm = '2:0';
savepoint sp1;
set global rpl_semi_sync_master_wait_cond_lwm = '1:0';
insert into t1 values(777);
set global rpl_semi_sync_master_wait_cond_lwm = '2:0';
rollback to sp1;
rollback;
start transaction;
set global rpl_semi_sync_master_wait_cond_lwm = '1:0';
insert into t1 values(666);
savepoint sp1;
set global rpl_semi_sync_master_wait_cond_lwm = '2:0';
release savepoint sp1;
rollback;
CHANGE MASTER TO  MASTER_HOST = 'localhost', MASTER_USER = 'repl_test', MASTER_PASSWORD = 'repl_test' ,MASTER_AUTO_POSITION = 1;
ERROR 42000: Access denied; you need (at least one of) the SUPER or REPLICATION_SLAVE_ADMIN privilege(s) for this operation
start slave;
ERROR 42000: Access denied; you need (at least one of) the SUPER or REPLICATION_SLAVE_ADMIN privilege(s) for this operation
stop slave;
ERROR 42000: Access denied; you need (at least one of) the SUPER or REPLICATION_SLAVE_ADMIN privilege(s) for this operation
reset slave;
reset slave all;
show slave hosts;
handler t1 open;
handler t1 read first;
id
1
handler t1 read next where id>30;
id
222
handler t1 read t1_index1=(11);
id
handler t1 close;
handler t2 open;
handler t2 read `PRIMARY`=(1);
id	name
1	1
handler t2 read `PRIMARY` first;
id	name
1	1
handler t2 read `PRIMARY` next;
id	name
2	2
checksum table t1;
Table	Checksum
it_quick_sync_read_only.t1	3712332462
do instr('abc','a');
do sleep(20);
prepare read_stmt from 'select * from t1 limit ?';
set @var1 = 2;
execute read_stmt using @var1;
id
1
2
deallocate prepare read_stmt;
XA START X'6162';
select * from t1;
id
1
2
3
222
333
XA END X'6162';
XA PREPARE X'6162';
XA COMMIT X'6162';
XA START X'6162';
select * from t1;
id
1
2
3
222
333
XA END X'6162';
XA ROLLBACK X'6162';
create tablespace test1_ibd add datafile 'test1.ibd' 
FILE_BLOCK_SIZE  = 16k
engine = innodb;
ERROR HY000: Active groups is less than the lwm cond, only support read.
drop tablespace test1_ibd;
ERROR HY000: Tablespace test1_ibd doesn't exist.
GET DIAGNOSTICS CONDITION 1
@p1 = RETURNED_SQLSTATE, @p2 = MESSAGE_TEXT;
explain select * from t1;
create temporary table tmp_t1(id int);
insert into tmp_t1 values(1);
update tmp_t1 set id = 2;
delete from tmp_t1;
update performance_schema.threads set HISTORY='NO' where thread_id = 48;
delete from performance_schema.threads where thread_id = 48;
ERROR 42000: DELETE command denied to user 'repl_test'@'localhost' for table 'threads'
purge binary logs to 'mysql-bin.000001';
ERROR 42000: Access denied; you need (at least one of) the SUPER or BINLOG_ADMIN privilege(s) for this operation
purge master logs to 'mysql-bin.000001';
ERROR 42000: Access denied; you need (at least one of) the SUPER or BINLOG_ADMIN privilege(s) for this operation
purge binary logs before '2017-09-25 22:10:10';
ERROR 42000: Access denied; you need (at least one of) the SUPER or BINLOG_ADMIN privilege(s) for this operation
BINLOG 'IKjNWQ8BAAAAdwAAAHsAAAABAAQANS43LjE3LWRlYnVnLWxvZwAAAAAAAAAAAAAAAAAAAAAAAAAAAAAAAAAAAAAAAAAAAAAgqM1ZEzgNAAgAEgAEBAQEEgAAXwAEGggAAAAICAgCAAAACgoKKioAEjQAATwKkAM=';
ERROR 42000: Access denied; you need (at least one of) the SUPER, BINLOG_ADMIN or REPLICATION_APPLIER privilege(s) for this operation
update t1 set id = 11 where id = 1;
ERROR HY000: Active groups is less than the lwm cond, only support read.
update t1,t2 set t1.id=555 where t1.id = t2.id;
ERROR HY000: Active groups is less than the lwm cond, only support read.
insert into t1 values(111);
ERROR HY000: Active groups is less than the lwm cond, only support read.
insert into t4 select * from t1;
ERROR HY000: Active groups is less than the lwm cond, only support read.
delete from t4 where id = 11;
ERROR HY000: Active groups is less than the lwm cond, only support read.
delete from t3,t4 USING t3 inner join t4 on  t3.id = t4.id;
ERROR HY000: Active groups is less than the lwm cond, only support read.
replace into t3 values(4);
ERROR HY000: Active groups is less than the lwm cond, only support read.
replace into t2 values(3,'5');
ERROR HY000: Active groups is less than the lwm cond, only support read.
replace into t4 select id from t2;
ERROR HY000: Active groups is less than the lwm cond, only support read.
repair table t1;
Table	Op	Msg_type	Msg_text
it_quick_sync_read_only.t1	repair	Error	Active groups is less than the lwm cond, only support read.
it_quick_sync_read_only.t1	repair	error	Corrupt
repair table tb_test1;
Table	Op	Msg_type	Msg_text
it_quick_sync_read_only.tb_test1	repair	Error	Active groups is less than the lwm cond, only support read.
it_quick_sync_read_only.tb_test1	repair	error	Corrupt
repair no_write_to_binlog table t1;
Table	Op	Msg_type	Msg_text
it_quick_sync_read_only.t1	repair	Error	Active groups is less than the lwm cond, only support read.
it_quick_sync_read_only.t1	repair	error	Corrupt
repair no_write_to_binlog table tb_test1;
Table	Op	Msg_type	Msg_text
it_quick_sync_read_only.tb_test1	repair	Error	Active groups is less than the lwm cond, only support read.
it_quick_sync_read_only.tb_test1	repair	error	Corrupt
optimize table t1;
ERROR HY000: Active groups is less than the lwm cond, only support read.
analyze table t1;
Table	Op	Msg_type	Msg_text
it_quick_sync_read_only.t1	analyze	Error	Active groups is less than the lwm cond, only support read.
it_quick_sync_read_only.t1	analyze	Error	Unable to store dynamic table statistics into data dictionary.
it_quick_sync_read_only.t1	analyze	status	Unable to write table statistics to DD tables
rename table t4 to t4_new;
ERROR HY000: Active groups is less than the lwm cond, only support read.
rename table t4_new to t4;
ERROR HY000: Active groups is less than the lwm cond, only support read.
select * into outfile '$MYSQLD_DATADIR/t1.csv' from t1;
ERROR HY000: The MySQL server is running with the --secure-file-priv option so it cannot execute this statement
load data infile '$MYSQLD_DATADIR/t1.csv' into table t4;
ERROR HY000: Active groups is less than the lwm cond, only support read.
lock tables t1 write;
ERROR HY000: Active groups is less than the lwm cond, only support read.
prepare insert_stmt from 'insert into t1 values(?)';
set @var1 = 1000;
execute insert_stmt using @var1;
ERROR HY000: Active groups is less than the lwm cond, only support read.
INSTALL PLUGIN test_udf_services SONAME 'test_udf_services.so';
ERROR HY000: Active groups is less than the lwm cond, only support read.
UNINSTALL PLUGIN test_udf_services;
ERROR HY000: Active groups is less than the lwm cond, only support read.
explain insert into t1 values(1);
ERROR HY000: Active groups is less than the lwm cond, only support read.
create table test1(id int);
ERROR HY000: Active groups is less than the lwm cond, only support read.
alter table test1 add column(id2 int ,id3 int);
ERROR HY000: Active groups is less than the lwm cond, only support read.
drop table test1;
ERROR HY000: Active groups is less than the lwm cond, only support read.
truncate table t4;
ERROR HY000: Active groups is less than the lwm cond, only support read.
create index t1_idx on t1(id);
ERROR HY000: Active groups is less than the lwm cond, only support read.
drop index t1_idx on t1;
ERROR HY000: Active groups is less than the lwm cond, only support read.
create view tmp_view2 as select * from t1;
ERROR HY000: Active groups is less than the lwm cond, only support read.
drop view if exists tmp_view2;
ERROR HY000: Active groups is less than the lwm cond, only support read.
create database if not exists  test_db;
ERROR HY000: Active groups is less than the lwm cond, only support read.
alter database character set = utf8;
ERROR HY000: Active groups is less than the lwm cond, only support read.
alter database COLLATE  = utf8_bin;
ERROR HY000: Active groups is less than the lwm cond, only support read.
drop database test_db;
ERROR HY000: Active groups is less than the lwm cond, only support read.
create function sf_test2(p_id int) returns int
DETERMINISTIC
begin
return p_id * p_id;
end
//
ERROR HY000: Active groups is less than the lwm cond, only support read.
drop function sf_test2;
ERROR 42000: FUNCTION it_quick_sync_read_only.sf_test2 does not exist
create procedure sp_test2(p_id int)
sql security invoker
begin
insert into t1 values(p_id);
end
//
ERROR HY000: Active groups is less than the lwm cond, only support read.
call sp_test2(11111);
ERROR 42000: execute command denied to user 'repl_test'@'localhost' for routine 'it_quick_sync_read_only.sp_test2'
alter procedure sp_test2 
language sql;
ERROR 42000: PROCEDURE it_quick_sync_read_only.sp_test2 does not exist
drop procedure sp_test2;
ERROR 42000: PROCEDURE it_quick_sync_read_only.sp_test2 does not exist
set @sum = 0;
create trigger trig_test2 before insert on t1 for each row 
set @sum = @sum + new.id;
ERROR HY000: Active groups is less than the lwm cond, only support read.
insert into t1 values(6666);
ERROR HY000: Active groups is less than the lwm cond, only support read.
select @sum;
@sum
0
drop trigger if exists  trig_test2;
ERROR HY000: Active groups is less than the lwm cond, only support read.
drop user if exists test_user;
ERROR HY000: Active groups is less than the lwm cond, only support read.
create user test_user@'%' identified by 'test_user';
ERROR HY000: Active groups is less than the lwm cond, only support read.
grant Replication client, Replication slave, Create, Delete, Drop, Select ON *.* to 'test_user'@'%';
ERROR HY000: Active groups is less than the lwm cond, only support read.
REVOKE  Replication client ON *.* from 'test_user'@'%';
ERROR HY000: Active groups is less than the lwm cond, only support read.
grant lock tables on *.* to repl_test@'%';
ERROR HY000: Active groups is less than the lwm cond, only support read.
rename user test_user to test_user_new;
ERROR HY000: Active groups is less than the lwm cond, only support read.
revoke all privileges, grant option from test_user;
ERROR HY000: Active groups is less than the lwm cond, only support read.
revoke all privileges, grant option from test_user_new;
ERROR HY000: Active groups is less than the lwm cond, only support read.
drop user test_user;
ERROR HY000: Active groups is less than the lwm cond, only support read.
CREATE SERVER s
FOREIGN DATA WRAPPER mysql
OPTIONS (USER 'repl_test', HOST '127.0.0.1', DATABASE 'test');
ERROR 42000: Access denied; you need (at least one of) the SUPER privilege(s) for this operation
ALTER SERVER s OPTIONS (USER 'sally');
ERROR 42000: Access denied; you need (at least one of) the SUPER privilege(s) for this operation
drop server s;
ERROR 42000: Access denied; you need (at least one of) the SUPER privilege(s) for this operation
create event event_test2
on schedule at CURRENT_TIMESTAMP  +  interval 1  minute 
do
update t3 set id = id + 20;
ERROR HY000: Active groups is less than the lwm cond, only support read.
alter event event_test1 
do 
update t3 set id = id + 30;
ERROR 42000: Access denied; you need (at least one of) the SYSTEM_USER privilege(s) for this operation
drop event if exists event_test2;
Warnings:
Note	1305	Event event_test2 does not exist
########################################################################
# Coverage Test
########################################################################
[connection server_1]
SET GLOBAL rpl_semi_sync_master_enabled= OFF;
[connection server_2]
include/uninstall_semisync_slave.inc
[connection server_1]
[connection server_1]
include/uninstall_semisync_master.inc
[connection server_1]
drop user repl_test@'localhost';
drop user repl_test@'%';
drop database it_quick_sync_read_only;
drop database `#mysql50#a-b-c`;
CALL mtr.add_suppression(".* Timeout waiting for reply of binlog .*");
CALL mtr.add_suppression(".* Failed to allocate memory for ack_array .*");
include/rpl_end.inc
