include/rpl_init.inc [topology=1->2]
Warnings:
Note	####	Sending passwords in plain text without SSL/TLS is extremely insecure.
Note	####	Storing MySQL user name or password information in the master info repository is not secure and is therefore not recommended. Please consider using the USER and PASSWORD connection options for START SLAVE; see the 'START SLAVE Syntax' in the MySQL Manual for more information.
include/rpl_sync.inc
[connection server_1]
include/install_semisync_master.inc
####################################################################
# Test Case: check the thread_pool_size of threadpool mode
####################################################################
include/assert.inc [ should be 4]
SET GLOBAL rpl_semi_sync_master_enabled = 0;
set global rpl_semi_sync_master_timeout = 1000;
###################################################################
# Test Case: add slave 2
###################################################################
[connection server_2]
include/install_semisync_slave.inc
[connection server_1]
###################################################################
# the base config and status for quick sync
###################################################################
set global rpl_semi_sync_master_wait_cond_hwm = '2:1';
set global rpl_semi_sync_master_wait_cond_lwm = '1:0';
set global rpl_semi_sync_master_group1 = '2,3:1';
set global rpl_semi_sync_master_group2 = '1,4:1';
set global rpl_semi_sync_master_enabled = ON;
include/assert.inc [Rpl_semi_sync_master_active_groups should be 2]
include/assert.inc [Rpl_semi_sync_master_current_stat_master_flag should be 1]
include/assert.inc [Rpl_semi_sync_master_current_wait_groups should be 1]
include/assert.inc [Rpl_semi_sync_master_err_flag should be 0]
include/assert.inc [Rpl_semi_sync_master_group1_status should be 1:GROUP_ACTIVE]
include/assert.inc [Rpl_semi_sync_master_group2_status should be 0:GROUP_ACTIVE]
###################################################################
# test ddl
###################################################################
drop database if exists it_quick_sync1;
Warnings:
Note	1008	Can't drop database 'it_quick_sync1'; database doesn't exist
drop database if exists it_quick_sync2;
Warnings:
Note	1008	Can't drop database 'it_quick_sync2'; database doesn't exist
drop database if exists it_quick_sync3;
Warnings:
Note	1008	Can't drop database 'it_quick_sync3'; database doesn't exist
create database it_quick_sync1;
create database it_quick_sync2;
create database it_quick_sync3;
use it_quick_sync1;
drop table if exists t1;
Warnings:
Note	1051	Unknown table 'it_quick_sync1.t1'
drop table if exists t2;
Warnings:
Note	1051	Unknown table 'it_quick_sync1.t2'
drop table if exists t3;
Warnings:
Note	1051	Unknown table 'it_quick_sync1.t3'
drop table if exists t4;
Warnings:
Note	1051	Unknown table 'it_quick_sync1.t4'
create table t1(id int);
create table t2(id int primary key, name varchar(10));
create table t3(id int);
select 'non Interactive trans';
non Interactive trans
non Interactive trans
insert into t1 values(3);
insert into t1 values(4);
drop table if exists t4;
Warnings:
Note	1051	Unknown table 'it_quick_sync1.t4'
create table t4(id int);
insert into t1 values(5);
insert into t1 values(6);
insert into t3 values(6);
drop table if exists t4;
create table t4(id int);
drop table if exists t4;
create table t4(id int);
drop table if exists t4;
create table t4(id int);
select 'Interactive trans';
Interactive trans
Interactive trans
begin ;
insert into t1 values(2);
insert into t1 values(3);
commit ;
begin ;
insert into t3 values(6);
insert into t3 values(7);
commit ;
begin ;
insert into t1 values(2);
drop table if exists t4;
create table t4(id int);
insert into t3 values(3);
commit ;
begin ;
insert into t2 values(2,'abcd');
insert into t2 values(2,'abcd');
ERROR 23000: Duplicate entry '2' for key 'PRIMARY'
commit ;
select 'stmts block';
stmts block
stmts block
begin;
insert into t1 values(6);
insert into t1 values(7);
commit;
//
begin;
insert into t3 values(6);
insert into t3 values(7);
commit;
//
begin;
insert into t3 values(6);
insert into t3 values(7);
commit;
//
begin;
insert into t1 values(6);
insert into t1 values(7);
commit;
//
insert into t1 values(2);
insert into t1 values(3);
//
insert into t3 values(2);
insert into t3 values(3);
//
insert into t1 values(2);
drop table if exists t3;
create table t3(id int);
insert into t1 values(3);
//
insert into t1 values(2);
drop table if exists t4;
create table t4(id int);
insert into t1 values(3);
drop table if exists t4;
create table t4(id int);
insert into t3 values(3);
//
insert into t1 values(2);
drop table if exists t4;
create table t4(id int);
insert into t1 values(3);
drop table if exists t4;
create table t4(id int);
insert into t3 values(3);
drop table if exists t4;
create table t4(id int);
insert into t3 values(3);
//
delete from t2;
insert into t2 values(2,'abcd');
insert into t2 values(2,'abcd');
insert into t2 values(2,'abcd');
//
ERROR 23000: Duplicate entry '2' for key 'PRIMARY'
delete from t2;
insert into t2 values(2,'abcd');
insert into t2 values(2,'xyz');
//
ERROR 23000: Duplicate entry '2' for key 'PRIMARY'
delete from t2;
delete from t2;
insert into t2 values(2,'abcd');
insert into t2 values(2,'xyz');
//
ERROR 23000: Duplicate entry '2' for key 'PRIMARY'
delete from t2;
insert into t2 values(2,'abcd');
insert into t2 values(2,'xyz');
insert into t2 values(3,'cccc');
//
ERROR 23000: Duplicate entry '2' for key 'PRIMARY'
use it_quick_sync2;
drop table if exists t1_1;
Warnings:
Note	1051	Unknown table 'it_quick_sync2.t1_1'
drop table if exists t2_1;
Warnings:
Note	1051	Unknown table 'it_quick_sync2.t2_1'
drop table if exists t3_1;
Warnings:
Note	1051	Unknown table 'it_quick_sync2.t3_1'
drop table if exists t4_1;
Warnings:
Note	1051	Unknown table 'it_quick_sync2.t4_1'
create table t1_1(id int);
create table t2_1(id int primary key, name varchar(10));
create table t3_1(id int);
select 'non Interactive trans';
non Interactive trans
non Interactive trans
insert into t1_1 values(3);
insert into t1_1 values(4);
drop table if exists t4_1;
Warnings:
Note	1051	Unknown table 'it_quick_sync2.t4_1'
create table t4_1(id int);
insert into t1_1 values(5);
insert into t1_1 values(6);
insert into t3_1 values(6);
drop table if exists t4_1;
create table t4_1(id int);
drop table if exists t4_1;
create table t4_1(id int);
drop table if exists t4_1;
create table t4_1(id int);
select 'Interactive trans';
Interactive trans
Interactive trans
begin ;
insert into t1_1 values(2);
insert into t1_1 values(3);
commit ;
begin ;
insert into t3_1 values(6);
insert into t3_1 values(7);
commit ;
begin ;
insert into t1_1 values(2);
drop table if exists t4_1;
create table t4_1(id int);
insert into t3_1 values(3);
commit ;
begin ;
insert into t2_1 values(2,'abcd');
insert into t2_1 values(2,'abcd');
ERROR 23000: Duplicate entry '2' for key 'PRIMARY'
commit ;
select 'stmts block';
stmts block
stmts block
begin;
insert into t1_1 values(6);
insert into t1_1 values(7);
commit;
//
begin;
insert into t3_1 values(6);
insert into t3_1 values(7);
commit;
//
begin;
insert into t3_1 values(6);
insert into t3_1 values(7);
commit;
//
begin;
insert into t1_1 values(6);
insert into t1_1 values(7);
commit;
//
insert into t1_1 values(2);
insert into t1_1 values(3);
//
insert into t3_1 values(2);
insert into t3_1 values(3);
//
insert into t1_1 values(2);
drop table if exists t3_1;
create table t3_1(id int);
insert into t1_1 values(3);
//
insert into t1_1 values(2);
drop table if exists t4_1;
create table t4_1(id int);
insert into t1_1 values(3);
drop table if exists t4_1;
create table t4_1(id int);
insert into t3_1 values(3);
//
insert into t1_1 values(2);
drop table if exists t4_1;
create table t4_1(id int);
insert into t1_1 values(3);
drop table if exists t4_1;
create table t4_1(id int);
insert into t3_1 values(3);
drop table if exists t4_1;
create table t4_1(id int);
insert into t3_1 values(3);
//
delete from t2_1;
insert into t2_1 values(2,'abcd');
insert into t2_1 values(2,'abcd');
insert into t2_1 values(2,'abcd');
//
ERROR 23000: Duplicate entry '2' for key 'PRIMARY'
delete from t2_1;
insert into t2_1 values(2,'abcd');
insert into t2_1 values(2,'xyz');
//
ERROR 23000: Duplicate entry '2' for key 'PRIMARY'
delete from t2_1;
delete from t2_1;
insert into t2_1 values(2,'abcd');
insert into t2_1 values(2,'xyz');
//
ERROR 23000: Duplicate entry '2' for key 'PRIMARY'
delete from t2_1;
insert into t2_1 values(2,'abcd');
insert into t2_1 values(2,'xyz');
insert into t2_1 values(3,'cccc');
//
ERROR 23000: Duplicate entry '2' for key 'PRIMARY'
use it_quick_sync3;
drop table if exists t1_2;
Warnings:
Note	1051	Unknown table 'it_quick_sync3.t1_2'
drop table if exists t2_2;
Warnings:
Note	1051	Unknown table 'it_quick_sync3.t2_2'
drop table if exists t3_2;
Warnings:
Note	1051	Unknown table 'it_quick_sync3.t3_2'
drop table if exists t4_2;
Warnings:
Note	1051	Unknown table 'it_quick_sync3.t4_2'
create table t1_2(id int);
create table t2_2(id int primary key, name varchar(10));
create table t3_2(id int);
select 'non Interactive trans';
non Interactive trans
non Interactive trans
insert into t1_2 values(3);
insert into t1_2 values(4);
drop table if exists t4_2;
Warnings:
Note	1051	Unknown table 'it_quick_sync3.t4_2'
create table t4_2(id int);
insert into t1_2 values(5);
insert into t1_2 values(6);
insert into t3_2 values(6);
drop table if exists t4_2;
create table t4_2(id int);
drop table if exists t4_2;
create table t4_2(id int);
drop table if exists t4_2;
create table t4_2(id int);
select 'Interactive trans';
Interactive trans
Interactive trans
begin ;
insert into t1_2 values(2);
insert into t1_2 values(3);
commit ;
begin ;
insert into t3_2 values(6);
insert into t3_2 values(7);
commit ;
begin ;
insert into t1_2 values(2);
drop table if exists t4_2;
create table t4_2(id int);
insert into t3_2 values(3);
commit ;
begin ;
insert into t2_2 values(2,'abcd');
insert into t2_2 values(2,'abcd');
ERROR 23000: Duplicate entry '2' for key 'PRIMARY'
commit ;
select 'stmts block';
stmts block
stmts block
begin;
insert into t1_2 values(6);
insert into t1_2 values(7);
commit;
//
begin;
insert into t3_2 values(6);
insert into t3_2 values(7);
commit;
//
begin;
insert into t3_2 values(6);
insert into t3_2 values(7);
commit;
//
begin;
insert into t1_2 values(6);
insert into t1_2 values(7);
commit;
//
insert into t1_2 values(2);
insert into t1_2 values(3);
//
insert into t3_2 values(2);
insert into t3_2 values(3);
//
insert into t1_2 values(2);
drop table if exists t3_2;
create table t3_2(id int);
insert into t1_2 values(3);
//
insert into t1_2 values(2);
drop table if exists t4_2;
create table t4_2(id int);
insert into t1_2 values(3);
drop table if exists t4_2;
create table t4_2(id int);
insert into t3_2 values(3);
//
insert into t1_2 values(2);
drop table if exists t4_2;
create table t4_2(id int);
insert into t1_2 values(3);
drop table if exists t4_2;
create table t4_2(id int);
insert into t3_2 values(3);
drop table if exists t4_2;
create table t4_2(id int);
insert into t3_2 values(3);
//
delete from t2_2;
insert into t2_2 values(2,'abcd');
insert into t2_2 values(2,'abcd');
insert into t2_2 values(2,'abcd');
//
ERROR 23000: Duplicate entry '2' for key 'PRIMARY'
delete from t2_2;
insert into t2_2 values(2,'abcd');
insert into t2_2 values(2,'xyz');
//
ERROR 23000: Duplicate entry '2' for key 'PRIMARY'
delete from t2_2;
delete from t2_2;
insert into t2_2 values(2,'abcd');
insert into t2_2 values(2,'xyz');
//
ERROR 23000: Duplicate entry '2' for key 'PRIMARY'
delete from t2_2;
insert into t2_2 values(2,'abcd');
insert into t2_2 values(2,'xyz');
insert into t2_2 values(3,'cccc');
//
ERROR 23000: Duplicate entry '2' for key 'PRIMARY'
########################################################################
# Coverage Test
########################################################################
SET GLOBAL rpl_semi_sync_master_enabled= OFF;
[connection server_2]
include/uninstall_semisync_slave.inc
[connection server_1]
[connection server_1]
include/uninstall_semisync_master.inc
[connection server_1]
drop database if exists it_quick_sync1;
drop database if exists it_quick_sync2;
drop database if exists it_quick_sync3;
CALL mtr.add_suppression(".* Timeout waiting for reply of binlog .*");
CALL mtr.add_suppression(".* Failed to allocate memory for ack_array .*");
include/rpl_end.inc
